<?xml version="1.0" encoding="utf-8"?>
<quizData xmlns:xsi="http://www.w3.org/2001/XMLSchema-instance" xsi:noNamespaceSchemaLocation="XmlQuizData.xsd">

  <parameters questionnaireId="_Gabon" logFileName="log.txt" fileLogLevel="MESSAGE" consoleLogLevel="MESSAGE" databaseName="diaphnea">
    <languageList>
      <language id="fr" name="Français" status="TRANSLATION_COMPLETED"/>
      <language id="en" name="English" status="IGNORE"/>
    </languageList>
    <questionnaireName>
      <name language="fr" text="Gabon"/>
      <name language="en" text="Gabon"/>
    </questionnaireName>
    <levelList>
      <level levelId="lv_Facile" value="0" choiceCount="4" questionCount="10" distribParameter="0.35">
        <name language="fr" text="Facile"/>
        <name language="en" text="Easy"/>
      </level>
      <level levelId="lv_Moyen" value="1" choiceCount="5" questionCount="15" distribParameter="0.2">
        <name language="fr" text="Moyen"/>
        <name language="en" text="Medium"/>
      </level>
      <level levelId="lv_Difficile" value="2" choiceCount="6" questionCount="15" distribParameter="0.1">
        <name language="fr" text="Difficile"/>
        <name language="en" text="Hard"/>
      </level>
    </levelList>
  </parameters>

  <typeDefinitions>
    <elementTypeList>
      <elementType id="et_Province" />
      <elementType id="et_Departement" />
      <elementType id="et_Ville" />
      <elementType id="et_FleuveRiviere" />
      <elementType id="et_Pays" />
    </elementTypeList>
    <attributeTypeList>
      <attributeType id="at_Nom1" canBeQuestion="true" />
      <attributeType id="at_Nom2" canBeQuestion="true" />
      <attributeType id="at_Numero" canBeQuestion="true" />
    </attributeTypeList>
    <numericalAttributeTypeList>
      <numericalAttributeType id="nt_Latitude" unit="°" ambiguityThreshold="0.4" displayPrecision="2"/>
      <numericalAttributeType id="nt_Longitude" unit="°" ambiguityThreshold="0.6" displayPrecision="2"/>
      <numericalAttributeType id="nt_Longueur" unit=" km" ambiguityThreshold="120" displayPrecision="0"/>
      <numericalAttributeType id="nt_Population" unit=" h" ambiguityThreshold="25000" displayPrecision="0"/>
    </numericalAttributeTypeList>
    <relation11TypeList>
      <relation11Type id="r11_Province_ChefLieu" startType="et_Province" endType="et_Ville" />
      <relation11Type id="r11_Departement_ChefLieu" startType="et_Departement" endType="et_Ville" />
    </relation11TypeList>
    <relation1NTypeList>
      <relation1NType id="r1N_Province_Departements" startType="et_Province" endType="et_Departement" />
      <relation1NType id="r1N_Departement_Villes" startType="et_Departement" endType="et_Ville"/>
      <relation1NType id="r1N_Riviere_Villes" startType="et_FleuveRiviere" endType="et_Ville" />
      <relation1NType id="r1N_Riviere_Affluents" startType="et_FleuveRiviere" endType="et_FleuveRiviere" />
    </relation1NTypeList>
    <relationNNTypeList>
      <relationNNType id="rNN_Riviere_Departements" startType="et_FleuveRiviere" endType="et_Departement" />
      <relationNNType id="rNN_Province_ProvincesLimitrophes" startType="et_Province" endType="et_Province" checkSymetry="YES_ERROR" />
      <relationNNType id="rNN_Departement_DepartementsLimitrophes" startType="et_Departement" endType="et_Departement" checkSymetry="YES_ERROR" />
      <relationNNType id="rNN_Pays_DepartementsLimitrophes" startType="et_Pays" endType="et_Departement" />
    </relationNNTypeList>
  </typeDefinitions>

  <elementList>
    <!--Provinces-->
    <element id="el_Estuaire" sortKey="1" type="et_Province" minLevel="0" >
      <elementName>
        <name language="fr" text="Estuaire"/>
        <name language="en" text="Estuaire"/>
      </elementName>
      <attributeList>
        <attribute type="at_Nom1">
          <value language="fr" value="L'Estuaire"/>
          <value language="en" value="Estuaire"/>
        </attribute>
        <attribute type="at_Nom2">
          <value language="fr" value="de l'Estuaire"/>
          <value language="en" value="Estuaire"/>
        </attribute>
        <attribute type="at_Numero">
          <value language="fr" value="1"/>
          <value language="en" value="1"/>
        </attribute>
      </attributeList>
      <numericalAttributeList>
        <numericalAttribute type="nt_Longitude" value="10"/>
        <numericalAttribute type="nt_Latitude" value="0.25"/>
      </numericalAttributeList>
      <relationList>
        <relation type="r11_Province_ChefLieu" linkedElement="el_Libreville"/>
        <relation type="rNN_Province_ProvincesLimitrophes" linkedElement="el_MoyenOgooue"/>
        <relation type="rNN_Province_ProvincesLimitrophes" linkedElement="el_OgooueMaritime"/>
        <relation type="rNN_Province_ProvincesLimitrophes" linkedElement="el_WoleuNtem"/>
      </relationList>
    </element>
    <element id="el_HautOgooue" sortKey="2" type="et_Province" minLevel="0" >
      <elementName>
        <name language="fr" text="Haut-Ogooué"/>
        <name language="en" text="Haut-Ogooué"/>
      </elementName>
      <attributeList>
        <attribute type="at_Nom1">
          <value language="fr" value="Le Haut-Ogooué"/>
          <value language="en" value="Haut-Ogooué"/>
        </attribute>
        <attribute type="at_Nom2">
          <value language="fr" value="du Haut-Ogooué"/>
          <value language="en" value="Haut-Ogooué"/>
        </attribute>
        <attribute type="at_Numero">
          <value language="fr" value="2"/>
          <value language="en" value="2"/>
        </attribute>
      </attributeList>
      <numericalAttributeList>
        <numericalAttribute type="nt_Longitude" value="13.8"/>
        <numericalAttribute type="nt_Latitude" value="-1.3"/>
      </numericalAttributeList>
      <relationList>
        <relation type="r11_Province_ChefLieu" linkedElement="el_Franceville"/>
        <relation type="rNN_Province_ProvincesLimitrophes" linkedElement="el_OgooueLolo"/>
        <relation type="rNN_Province_ProvincesLimitrophes" linkedElement="el_OgooueIvindo"/>
      </relationList>
    </element>
    <element id="el_MoyenOgooue" sortKey="3" type="et_Province" minLevel="0" >
      <elementName>
        <name language="fr" text="Moyen-Ogooué"/>
        <name language="en" text="Moyen-Ogooué"/>
      </elementName>
      <attributeList>
        <attribute type="at_Nom1">
          <value language="fr" value="Le Moyen-Ogooué"/>
          <value language="en" value="Moyen-Ogooué"/>
        </attribute>
        <attribute type="at_Nom2">
          <value language="fr" value="du Moyen-Ogooué"/>
          <value language="en" value="Moyen-Ogooué"/>
        </attribute>
        <attribute type="at_Numero">
          <value language="fr" value="3"/>
          <value language="en" value="3"/>
        </attribute>
      </attributeList>
      <numericalAttributeList>
        <numericalAttribute type="nt_Longitude" value="10.55"/>
        <numericalAttribute type="nt_Latitude" value="-0.35"/>
      </numericalAttributeList>
      <relationList>
        <relation type="r11_Province_ChefLieu" linkedElement="el_Lambarene"/>
        <relation type="rNN_Province_ProvincesLimitrophes" linkedElement="el_Estuaire"/>
        <relation type="rNN_Province_ProvincesLimitrophes" linkedElement="el_Ngounie"/>
        <relation type="rNN_Province_ProvincesLimitrophes" linkedElement="el_OgooueIvindo"/>
        <relation type="rNN_Province_ProvincesLimitrophes" linkedElement="el_OgooueMaritime"/>
        <relation type="rNN_Province_ProvincesLimitrophes" linkedElement="el_WoleuNtem"/>
      </relationList>
    </element>
    <element id="el_Ngounie" sortKey="4" type="et_Province" minLevel="0" >
      <elementName>
        <name language="fr" text="Ngounié"/>
        <name language="en" text="Ngounié"/>
      </elementName>
      <attributeList>
        <attribute type="at_Nom1">
          <value language="fr" value="La Ngounié"/>
          <value language="en" value="Ngounié"/>
        </attribute>
        <attribute type="at_Nom2">
          <value language="fr" value="de la Ngounié"/>
          <value language="en" value="Ngounié"/>
        </attribute>
        <attribute type="at_Numero">
          <value language="fr" value="4"/>
          <value language="en" value="4"/>
        </attribute>
      </attributeList>
      <numericalAttributeList>
        <numericalAttribute type="nt_Longitude" value="11.25"/>
        <numericalAttribute type="nt_Latitude" value="-1.65"/>
      </numericalAttributeList>
      <relationList>
        <relation type="r11_Province_ChefLieu" linkedElement="el_Mouila"/>
        <relation type="rNN_Province_ProvincesLimitrophes" linkedElement="el_MoyenOgooue"/>
        <relation type="rNN_Province_ProvincesLimitrophes" linkedElement="el_OgooueLolo"/>
        <relation type="rNN_Province_ProvincesLimitrophes" linkedElement="el_Nyanga"/>
        <relation type="rNN_Province_ProvincesLimitrophes" linkedElement="el_OgooueMaritime"/>
      </relationList>
    </element>
    <element id="el_Nyanga" sortKey="5" type="et_Province" minLevel="0" >
      <elementName>
        <name language="fr" text="Nyanga"/>
        <name language="en" text="Nyanga"/>
      </elementName>
      <attributeList>
        <attribute type="at_Nom1">
          <value language="fr" value="La Nyanga"/>
          <value language="en" value="Nyanga"/>
        </attribute>
        <attribute type="at_Nom2">
          <value language="fr" value="de la Nyanga"/>
          <value language="en" value="Nyanga"/>
        </attribute>
        <attribute type="at_Numero">
          <value language="fr" value="5"/>
          <value language="en" value="5"/>
        </attribute>
      </attributeList>
      <numericalAttributeList>
        <numericalAttribute type="nt_Longitude" value="11.05"/>
        <numericalAttribute type="nt_Latitude" value="-3.05"/>
      </numericalAttributeList>
      <relationList>